<?xml version="1.0" encoding="UTF-8"?><property xmlns="http://faculty.washington.edu/tgis/schemasProject/xsd4md" xmlns:xsi="http://www.w3.org/2001/XMLSchema-instance" xmlns:xs="http://www.w3.org/2001/XMLSchema" xsi:schemaLocation="http://faculty.washington.edu/tgis/schemasProject/xsd4md http://faculty.washington.edu/tgis/schemasProject/xsd4md/schema-4-properties.xsd">
    <labels>
        <platformIndependent>institution</platformIndependent>
        <dc>provenance</dc>
    </labels>
    <cdm>
        <label>Institution</label>
        <cdmDatatype>text</cdmDatatype>
        <cdmLarge>no</cdmLarge>
        <searchable>yes</searchable>
        <hidden>yes</hidden>
        <cdmRequired>no</cdmRequired><uwRequired>no</uwRequired>
        <cdmControlledVocab>no</cdmControlledVocab>
    </cdm>
    <dspace>
        <dspaceProperty/>
    </dspace>
    <descriptions>
        <definition>
            <para>[Uncertain]</para>
        </definition>
        <instructions co="no">
            <para>[Uncertain]</para>
        </instructions>
        <instructions co="object">
            <para>[Uncertain]</para>
        </instructions>
        <instructions co="item">
            <para>[Uncertain]</para>
        </instructions>
        
    </descriptions>
    <examples>
        <example co="no">
            <para>[none]</para>
        </example>
        
        <!-- customization here is flawed.
             I think we need
             <customizations>
                 <description | example>
                     <para @co @dd @paraDec @paraEx> REPEATABLE
                         <para>
        -->
        
    </examples>
    <additionalInfo>
        <admin co="all">
            <para>Seems to be a DI/ITS admin field.</para>
            <para>For use with CONTENTdm "facets?"</para>
            <para>This is a misuse of the dc:provenance property; we should repair this property?</para>
        </admin>
    </additionalInfo>
    <marc>
        <dcgMarcMapping/>
        <marcNotes>
            <para/>
        </marcNotes>
    </marc>
    <xsd>
        <typeAttribute>xs:string</typeAttribute>
        <complexType/>
    </xsd>
    <rdf>
        <sameAs/>
    </rdf>
    <history>
        <dateCreated>
            <range>
                <start>2000-01-01</start>
                <end>2015-02-21</end>
            </range>
        </dateCreated>
        <created4Coll>Alaska Yukon Pacific Exposition Photographs</created4Coll>
        <justification>[Uncertain]</justification>
        <changeLog>
            <change/><change date="2017-10-23">changed //cdm/required to //cdm/cdmRequired and //cdm/uwRequired to assist in halting use of the cdm "required" feature while, at the same time, indicating that UW-cdm collections must use, or not use, a given property; also changed @xsi:schemaLocation.</change>
        </changeLog>
    </history>
</property>