<?xml version="1.0" encoding="UTF-8"?>
<property xmlns="http://faculty.washington.edu/tgis/schemasProject/xsd4md"
    xmlns:xsi="http://www.w3.org/2001/XMLSchema-instance"
    xmlns:xs="http://www.w3.org/2001/XMLSchema"
    xsi:schemaLocation="http://faculty.washington.edu/tgis/schemasProject/xsd4md http://faculty.washington.edu/tgis/schemasProject/xsd4md/schema-4-properties.xsd">
    <labels>
        <platformIndependent>dateCreated</platformIndependent>
        <dc>created</dc>
        <!-- I don't think we need schemaLabel; shemas are to be produced for validating cdm exports; look at thos exports and see how the property labels export; the cdmLabel might be adequate for producing the schema -->
    </labels>
    <cdm>
        <label>Date</label>
        <cdmDatatype>text</cdmDatatype>
        <cdmLarge>no</cdmLarge>
        <searchable>no</searchable>
        <hidden>no</hidden>
        <cdmRequired>no</cdmRequired>
        <uwRequired>yes</uwRequired>
        <cdmControlledVocab>no</cdmControlledVocab>
    </cdm>
    <dspace>
        <dspaceProperty/>
    </dspace>
    <descriptions>
        <definition>
            <para>Date of creation of the resource.</para>
            <para>If the resource is a photograph, the date the original photograph was taken.</para>
            <para>In cases where a painting, engraving, or architectural drawing was photographed, the date the artwork was created.</para>
        </definition>
        <instructions co="no">
            <para>If the date when the image/resource in hand was produced is known, and is different from that of the original image, so note in the Notes field. The date should be a specific year. If the date is unknown, an attempt should be made to assign an approximate date, using the form "ca." (circa).</para>
            <para>In CONTENTdm, this field is used for display purposes and should be user-friendly. The Dates field is indexed, enabling searching (see that entry for details). Specific dates (e.g., September 12, 1933; June 1912) should be entered in this field, and should also be incorporated in the Title field.</para>
            <para>Date value should agree with date values entered in Date-Edtf and Dates fields.</para>
            <para>If the date is a single year, enter the date in the following format: YYYY</para>
            <para>If the date is a month and a year, enter name-of-month, YYYY</para>
            <para>If the date is a month, day and year, enter name-of-month number-of-day, YYYY</para>
            <para>If the date is a known date range, enter the two dates as above, separated with a dash</para>
            <para>If the date between a date range or an approximate date, the date should be qualified with either the word "between" or "approximately."</para>
        </instructions>
        <instructions co="object">
            <para>If the date when the image/resource in hand was produced is known, and is different from that of the original image, so note in the Notes field. The date should be a specific year. If the date is unknown, an attempt should be made to assign an approximate date, using the form "ca." (circa).</para>
            <para>In CONTENTdm, this field is used for display purposes and should be user-friendly. The Dates field is indexed, enabling searching (see that entry for details). Specific dates (e.g., September 12, 1933; June 1912) should be entered in this field, and should also be incorporated in the Title field.</para>
            <para>Date value should agree with date values entered in Date-Edtf and Dates fields.</para>
            <para>If the date is a single year, enter the date in the following format: YYYY</para>
            <para>If the date is a month and a year, enter name-of-month, YYYY</para>
            <para>If the date is a month, day and year, enter name-of-month number-of-day, YYYY</para>
            <para>If the date is a known date range, enter the two dates as above, separated with a dash</para>
            <para>If the date between a date range or an approximate date, the date should be qualified with either the word "between" or "approximately."</para>
        </instructions>
    </descriptions>
    <examples>
        <example co="no">
            <para>1940</para>
            <para>May, 2001</para>
            <para>May 9, 2001</para>
            <para>1946-1952</para>
            <para>May 2, 1946-June 4, 1952</para>
            <para>Between 1910 and 1923</para>
            <para>Approximately 1930</para>
        </example>
        <example co="object">
            <para>1940</para>
            <para>May, 2001</para>
            <para>May 9, 2001</para>
            <para>1946-1952</para>
            <para>May 2, 1946-June 4, 1952</para>
            <para>Between 1910 and 1923</para>
            <para>Approximately 1930</para>
        </example>
    </examples>
    <additionalInfo/>
    <marc>
        <dcgMarcMapping/>
        <marcNotes/>
    </marc>
    <xsd>
        <simpleType>
            <xs:restriction base="xs:string">
                <xs:minLength value="1"/>
            </xs:restriction>
        </simpleType>
    </xsd>
    <rdf>
        <sameAs/>
    </rdf>
    <history>
        <dateCreated>
            <range>
                <start>2000-01-01</start>
                <end>2016-11-10</end>
            </range>
        </dateCreated>
        <created4Coll>Special Collections Photograph Collections</created4Coll>
        <justification>We need a display dates field that will be easy for users to understand. It does not need to be indexed but it seems OK to map to Dublin Core.</justification>
        <changeLog>
            <change/>
            <change date="2017-10-23">changed //cdm/required to //cdm/cdmRequired and //cdm/uwRequired to assist in halting use of the cdm "required" feature while, at the same time, indicating that UW-cdm collections must use, or not use, a given property; also changed @xsi:schemaLocation. Also added instruction.</change>
        </changeLog>
    </history>
</property>
