<?xml version="1.0" encoding="UTF-8"?>
<property xmlns="http://faculty.washington.edu/tgis/schemasProject/xsd4md"
   xmlns:xsi="http://www.w3.org/2001/XMLSchema-instance" xmlns:xs="http://www.w3.org/2001/XMLSchema"
   xsi:schemaLocation="http://faculty.washington.edu/tgis/schemasProject/xsd4md http://faculty.washington.edu/tgis/schemasProject/xsd4md/schema-4-properties.xsd">
   <uid>p6</uid>
   <labels>
      <platformIndependent>author</platformIndependent>
      <dc>creator</dc>
   </labels>
   <uwRequired>
      <uwStandalone>no</uwStandalone>
      <uwObject>no</uwObject>
      <uwItem>no</uwItem>
   </uwRequired>
   <cdm>
      <label>Author</label>
      <cdmDatatype>text</cdmDatatype>
      <cdmLarge>no</cdmLarge>
      <searchable>yes</searchable>
      <hidden>no</hidden>
      <cdmRequired>no</cdmRequired>
      <cdmControlledVocab>no</cdmControlledVocab>
   </cdm>
   <dspace>
      <dspaceProperty/>
   </dspace>
   <descriptions>
      <definition>
         <para>The person or the corporate body responsible for the textual content.</para>
      </definition>
      <instructions co="no">
         <para>Input lastname, firstname or the corporate body name.</para>
         <para>Use LC Authority File for form of name, if available.</para>
         <para>Multiple names are okay; separate multiple names with a semi-colon.</para>
         <para>If the Creator is determined from a resource other than the item, create a Note.</para>
         <para>If there is no author, leave the field blank.</para>
      </instructions>
      <instructions co="object">
         <para>Input lastname, firstname or the corporate body name.</para>
         <para>Use LC Authority File for form of name, if available.</para>
         <para>Multiple names are okay; separate multiple names with a semi-colon.</para>
         <para>If the Creator is determined from a resource other than the item, create a Note.</para>
         <para>If there is no author, leave the field blank.</para>
      </instructions>
      <customization co="object" dd="ssdc">
         <para>Search for author name in Library of Congress Name Authority File; if record exists, transcribe name as it appears in the name authority file, including dates.</para>
         <para>If no record exists, transliterate author name on title page using LOC rules.</para>
         <para>Author names usually appear on title page after the following designations: el autor; kompuesto; por.</para>
      </customization>
   </descriptions>
   <examples>
      <example co="all">
         <para>Strong, Lyman W.</para>
      </example>
      <customization co="object" dd="ssdc">
         <para>Saint-Pierre, Bernardin de, 1737-1814.</para>
      </customization>
   </examples>
   <additionalInfo/>
   <marc>
      <dcgMarcMapping/>
      <marcNotes/>
   </marc>
   <xsd>
      <typeInfo level="standalone object">
         <typeAttribute>xs:string</typeAttribute>
      </typeInfo>
      <typeInfo level="item">
         <empty/>
      </typeInfo>
   </xsd>
   <rdf>
      <!-- no RDF info yet for author -->
   </rdf>
   <history>
      <dateCreated>
         <range>
            <start>2000-01-01</start>
            <end>2017-06-29</end>
         </range>
      </dateCreated>
      <created4Coll>Special Collections Civil War Letters Collection, and Special Collections Pamphlet and Textul Collection</created4Coll>
      <justification>Wanted a way to distinguish authors of text.</justification>
      <changeLog>
         <change/>
         <change date="2017-10-23">changed //cdm/required to //cdm/cdmRequired and //cdm/uwRequired to assist in halting use of the cdm "required" feature while, at the same time, indicating that UW-cdm collections must use, or not use, a given property; also changed @xsi:schemaLocation.</change>
      </changeLog>
   </history>
</property>
