<?xml version="1.0" encoding="UTF-8"?>
<property xmlns="http://faculty.washington.edu/tgis/schemasProject/xsd4md"
          xmlns:xsi="http://www.w3.org/2001/XMLSchema-instance"
          xmlns:xs="http://www.w3.org/2001/XMLSchema"
          xsi:schemaLocation="http://faculty.washington.edu/tgis/schemasProject/xsd4md http://faculty.washington.edu/tgis/schemasProject/xsd4md/schema-4-properties.xsd">
   <labels>
      <platformIndependent>locationDepicted</platformIndependent>
      <dc>spatial</dc>
   </labels>
   <uwRequired>
      <uwStandalone>no</uwStandalone>
      <uwObject>no</uwObject>
      <uwItem>no</uwItem>
   </uwRequired>
   <cdm>
      <label>Location Depicted</label>
      <cdmDatatype>text</cdmDatatype>
      <cdmLarge>no</cdmLarge>
      <searchable>yes</searchable>
      <hidden>no</hidden>
      <cdmRequired>no</cdmRequired>
      <cdmControlledVocab>yes</cdmControlledVocab>
   </cdm>
   <dspace>
      <dspaceProperty/>
   </dspace>
   <descriptions>
      <definition>
         <para>The spatial characteristics of the intellectual content of the resource. </para>
         <para>Spatial coverage refers to a physical region.</para>
      </definition>
      <instructions co="no">
         <para>Enter Country--State or Province--City.</para>
         <para>Places names are derived from the LC Authority File.</para>
      </instructions>
      <instructions co="object">
         <para>Enter Country--State or Province--City.</para>
         <para>Places names are derived from the LC Authority File.</para>
      </instructions>
   </descriptions>
   <examples>
      <example co="no">
         <para>United States--Washington (State)—Seattle</para>
         <para>United States--Alaska—Fort Yukon</para>
         <para>Canada—Yukon—Dawson </para>
         <para>Croatia--Zagreb [use current form, even though Yugoslavia was the name when the photo was taken]</para>
         <para>Russia (Federation)--Leningradskaia oblast--Saint Petersburg [use current form, even though it was called Leningrad in Soviet Union, when photo was taken]</para>
      </example>
      <example co="object">
         <para>United States--Washington (State)—Seattle</para>
         <para>United States--Alaska—Fort Yukon</para>
         <para>Canada—Yukon—Dawson </para>
         <para>Croatia--Zagreb [use current form, even though Yugoslavia was the name when the photo was taken]</para>
         <para>Russia (Federation)--Leningradskaia oblast--Saint Petersburg [use current form, even though it was called Leningrad in Soviet Union, when photo was taken]</para>
      </example>
      <customization co="no" dd="neareast">
         <para>Egypt</para>
         <para>Egypt--Alexandria</para>
         <para>Egypt--Cairo--Jizah</para>
         <para>Egypt--Dayr al-Bahri Site</para>
         <para>Egypt--Nile River Delta</para>
         <para>Israel--West Bank--Jericho</para>
      </customization>
   </examples>
   <additionalInfo/>
   <marc>
      <dcgMarcMapping/>
      <marcNotes>
         <para/>
      </marcNotes>
   </marc>
   <xsd>
      <typeInfo level="standalone object">
         <typeAttribute>xs:string</typeAttribute>
      </typeInfo>
      <typeInfo level="item">
         <empty/>
      </typeInfo>
   </xsd>
   <rdf>
      <sameAs/>
   </rdf>
   <history>
      <dateCreated>
         <range>
            <start>2000-01-01</start>
            <end>2017-01-06</end>
         </range>
      </dateCreated>
      <created4Coll>Special Collections Photograph Collections</created4Coll>
      <justification>We wanted a property dedicated to describing the location depicted in an image.</justification>
      <changeLog>
         <change/>
         <change date="2017-10-23">changed //cdm/required to //cdm/cdmRequired and //cdm/uwRequired to assist in halting use of the cdm "required" feature while, at the same time, indicating that UW-cdm collections must use, or not use, a given property; also changed @xsi:schemaLocation.</change>
      </changeLog>
   </history>
</property>
