<?xml version="1.0" encoding="UTF-8"?><property xmlns="http://faculty.washington.edu/tgis/schemasProject/xsd4md" xmlns:xsi="http://www.w3.org/2001/XMLSchema-instance" xmlns:xs="http://www.w3.org/2001/XMLSchema" xsi:schemaLocation="http://faculty.washington.edu/tgis/schemasProject/xsd4md http://faculty.washington.edu/tgis/schemasProject/xsd4md/schema-4-properties.xsd"><uid>p50</uid><labels>
      <platformIndependent>language</platformIndependent>
      <dc>language</dc>
   </labels><uwRequired>
      <uwStandalone>no</uwStandalone>
      <uwObject>no</uwObject>
      <uwItem>no</uwItem>
   </uwRequired><cdm>
      <label>Language</label>
      <cdmDatatype>text</cdmDatatype>
      <cdmLarge>no</cdmLarge>
      <searchable>yes</searchable>
      <hidden>no</hidden>
      <cdmRequired>no</cdmRequired>
      <cdmControlledVocab>no</cdmControlledVocab>
   </cdm><dspace>
      <dspaceProperty/>
   </dspace><descriptions>
      <definition>
         <para>A language of the resource.</para>
      </definition>
      <instructions co="object">
         <para>Name of language(s) used in the interview fully spelled out.</para>
      </instructions>
   </descriptions><examples>
      <example co="object">
         <para>English</para>
         <para>Spanish</para>
      </example>
   </examples><additionalInfo>
      <admin co="object"/>
   </additionalInfo><marc>
      <dcgMarcMapping/>
      <marcNotes/>
   </marc><xsd>
      <typeInfo level="object">
         <typeAttribute>xs:string</typeAttribute>
      </typeInfo>
   </xsd><rdf>
      <sameAs/>
   </rdf><history>
      <dateCreated>
         <single>2018-03-26</single>
      </dateCreated>
      <created4Coll>University of Washington Tacoma Oral Histories</created4Coll>
      <justification>MIG requested this field for UWT Oral Histories, allowing language to be indexed, as we do with other oral histories.</justification>
      <changeLog>
         <change/>
      </changeLog>
   </history></property>