<?xml version="1.0" encoding="UTF-8"?><property xmlns="http://faculty.washington.edu/tgis/schemasProject/xsd4md" xmlns:xsi="http://www.w3.org/2001/XMLSchema-instance" xmlns:xs="http://www.w3.org/2001/XMLSchema" xsi:schemaLocation="http://faculty.washington.edu/tgis/schemasProject/xsd4md http://faculty.washington.edu/tgis/schemasProject/xsd4md/schema-4-properties.xsd"><uid>p55</uid><labels>
      <platformIndependent>notes</platformIndependent>
      <dc>description</dc>
   </labels><uwRequired>
      <uwStandalone>no</uwStandalone>
      <uwObject>no</uwObject>
      <uwItem>no</uwItem>
   </uwRequired><cdm>
      <label>Notes</label>
      <cdmDatatype>text</cdmDatatype>
      <cdmLarge>yes</cdmLarge>
      <searchable>yes</searchable>
      <hidden>no</hidden>
      <cdmRequired>no</cdmRequired>
      <cdmControlledVocab>no</cdmControlledVocab>
   </cdm><dspace>
      <dspaceProperty/>
   </dspace><descriptions>
      <definition>
         <para>An account of the resource.</para>
      </definition>
      <instructions co="no">
         <para>Enter any information of importance that is not represented elsewhere.</para>
         <para>Each separate "note" should be a paragraph. Additional notes can be added, separated from the previous note using a blank line.</para>
      </instructions>
      <instructions co="object">
         <para>Enter any information of importance that is not represented elsewhere.</para>
         <para>Each separate "note" should be a paragraph. Additional notes can be added, separated from the previous note using a blank line.</para>
      </instructions>
      <customization co="no" dd="ac">
         <para>An account of the drawing.</para>
         <para>Notes include any information of importance that is not represented elsewhere.</para>
      </customization>
      <customization co="object" dd="uwtoh">
         <para>Enter any descriptive narrative information of importance about the project and its subjects that is not recorded elsewhere.</para>
         <para>Each separate "note" should be a paragraph. Additional notes can be added, separated from the previous note using a blank line.</para>
      </customization>
   </descriptions><examples>
      <example co="no">
         <para>Photographs taken by Asahel Curtis during his trip to the Klondike in 1897-1899.</para>
         <para>Caption on image: Curtis 319.</para>
         <para>Handwritten on verso: Mrs. McLain with dog team.</para>
         <para>PH Coll 519.319</para>
      </example>
      <example co="object">
         <para>Photographs taken by Asahel Curtis during his trip to the Klondike in 1897-1899.</para>
         <para>Caption on image: Curtis 319.</para>
         <para>Handwritten on verso: Mrs. McLain with dog team.</para>
         <para>PH Coll 519.319</para>
      </example>
      <customization co="no" dd="ac">
         <para>Handwritten in title block: Apartment house. Osborn, Architect. 325 Leary Bldg., Seattle, Wash. E.C.R. [drawn by?]</para>
         <para>Handwritten beneath drawing: First floor plan. Scale: 1/16" to 1'</para>
         <para>Plans for a frame hotel to be erected by the Lake View Land Co. at Lakeview, Wash.</para>
         <para>Stamped on cover sheet: Farrell and Darmer, Architects, Tacoma, Wash. Ter.</para>
         <para>From inventory: (1890)</para>
         <para>Residence for Mr. C.J. Lord</para>
         <para>Written in title block: Residence for Mr. C.J. Lord; 21st and Columbia Streets, Olympia, Washington; Basement and Foundation plan; Joseph H. Wohleb, Architect. Olympia, Wash.; Drawn by Y.D.W.; Traced by W.W.; Date Feb. 1923;Comm. No. 251; Sheet no. 2; Scale: 1/4" to 1'</para>
      </customization>
      <customization co="object" dd="uwtoh">
         <para>The oral history interview with Michal Sullivan was part of the “Founding Stories” phase of the UW Tacoma Oral History Project.
         </para>
      </customization>
   </examples><additionalInfo>
      <generalNotes co="all">
         <para>"Notes" is distingushed from "Historical Notes" mainly because it descibes the image/resource only. Values in this field also may be considered more "indexable" insofar as they precisely descibe the image/resource. "HistoricalNotes" are more like "writing" and create a broad historical context.</para>
      </generalNotes>
   </additionalInfo><marc>
      <dcgMarcMapping/>
      <marcNotes>
         <para/>
      </marcNotes>
   </marc><xsd>
      <typeInfo level="standalone object">
         <typeAttribute>xs:string</typeAttribute>
      </typeInfo>
      <typeInfo level="item">
         <empty/>
      </typeInfo>
   </xsd><rdf>
      <cdmRdf>
         <dpla>
            <map xml:lang="en">dct:description</map>
            <object>literal</object>
            <class>SourceResource</class>
            <process>cleanNotes</process>
            <node/>
         </dpla>
      </cdmRdf>
   </rdf><history>
      <dateCreated>
         <range>
            <start>2000-01-01</start>
            <end>2017-01-06</end>
         </range>
      </dateCreated>
      <created4Coll>Special Collections Photograph Collections</created4Coll>
      <justification>Needed a place to enter all "other" information valuable to the description of the resource.</justification>
      <changeLog>
         <change/>
         <change date="2017-10-23">changed //cdm/required to //cdm/cdmRequired and //cdm/uwRequired to assist in halting use of the cdm "required" feature while, at the same time, indicating that UW-cdm collections must use, or not use, a given property; also changed @xsi:schemaLocation.</change>
         <change date="2018-02-27">Added customization for Architecture of the Pacific Northwest.</change>
      </changeLog>
   </history></property>