<?xml version="1.0" encoding="UTF-8"?><property xmlns="http://faculty.washington.edu/tgis/schemasProject/xsd4md" xmlns:xsi="http://www.w3.org/2001/XMLSchema-instance" xmlns:xs="http://www.w3.org/2001/XMLSchema" xsi:schemaLocation="http://faculty.washington.edu/tgis/schemasProject/xsd4md http://faculty.washington.edu/tgis/schemasProject/xsd4md/schema-4-properties.xsd"><uid>p2</uid><labels>
      <platformIndependent>alternativeTitle</platformIndependent>
      <dc>alternative</dc>
   </labels><uwRequired>
      <uwStandalone>no</uwStandalone>
      <uwObject>no</uwObject>
      <uwItem>no</uwItem>
   </uwRequired><cdm>
      <label>Alternative Title</label>
      <cdmDatatype>text</cdmDatatype>
      <cdmLarge>no</cdmLarge>
      <searchable>yes</searchable>
      <hidden>no</hidden>
      <cdmRequired>no</cdmRequired>
      <cdmControlledVocab>no</cdmControlledVocab>
   </cdm><dspace>
      <dspaceProperty/>
   </dspace><descriptions>
      <definition>
         <para>An alternative name for the resource.</para>
      </definition>
      <instructions co="no">
         <para>Enter an alternative title; may or may not follow instructions for entering titles.</para>
         <para>When applicable, add a note in the Notes field describing the source of the alternative title.</para>
      </instructions>
   </descriptions><examples>
      <example co="no">
         <para>Century 21 Restaurant and Observation Tower</para>
         <para>Wu Building</para>
      </example>
      <customization co="no"/>
   </examples><additionalInfo/><marc>
      <dcgMarcMapping>
         
      </dcgMarcMapping>
      <dcgNotes>
         
      </dcgNotes>
      <marcNotes/>
   </marc><xsd>
      <typeInfo level="standalone">
         <typeAttribute>xs:string</typeAttribute>
      </typeInfo>
   </xsd><rdf>
      <sameAs/>
   </rdf><history>
      <dateCreated>
         <range>
            <start>2006-01-01</start>
            <end>2018-02-20</end>
         </range>
      </dateCreated>
      <created4Coll>Architecture of the Pacific Northwest</created4Coll>
      <justification>Alternative titles are often needed on the digital collections.</justification>
      <changeLog>
         <change/>
         
      </changeLog>
   </history></property>